{
  "version": "pol.v0.2",
  "id": "pol_01HXZ8K9P4QN2M1R3T5V7W9X",
  "actions": ["payments.send"],
  "resources": [
    {
      "type": "merchant",
      "match": {
        "ids": ["airbnb", "expedia"]
      }
    }
  ],
  "limits": {
    "per_txn": {
      "amount": 500,
      "currency": "USD"
    },
    "per_period": {
      "amount": 1500,
      "currency": "USD",
      "period": "week"
    }
  },
  "constraints": {
    "time": {
      "dow": ["Mon", "Tue", "Wed", "Thu", "Fri"],
      "start": "08:00",
      "end": "20:00",
      "tz": "America/Los_Angeles"
    }
  },
  "strict": true,
  "meta": {
    "note": "Travel expense policy"
  }
}

