{
  "version": "pol.v0.2",
  "id": "pol_test_001",
  "actions": ["payments.send"],
  "resources": [
    {"type": "merchant", "match": {"ids": ["airbnb", "expedia"]}}
  ],
  "limits": {
    "per_txn": {"amount": 500, "currency": "USD"},
    "per_period": {"amount": 1500, "currency": "USD", "period": "week"}
  },
  "constraints": {
    "time": {
      "start": "08:00",
      "end": "20:00",
      "tz": "UTC"
    }
  }
}

